,question,answer,contexts,ground_truth,faithfulness,answer_relevancy,context_recall,context_precision,answer_correctness
0,"What did Kim Kardashian claim about Taylor Swift's knowledge of the lyrics of Kanye West's song ""Famous""?","Kim Kardashian claimed that Taylor Swift knew of the infamous Kanye West ""Famous"" lyric all along.","['“Famous” lyric all along\xa0\n""She totally approved that,"" Kardashian said in the July issue of GQ that\nyear regarding Swift\'s knowledge of the lyrics of ""Famous"" before the\nsong\'s release.'
 'actual lyrics, \'I made that bitch famous.\'""\nThe Internet immediately seemed to side with the reality star, and\n#KimExposedTaylorParty started trending.\nJuly 17\n, 2016: Taylor Swift defends herself'
 'will be the greatest feeling in the world. Thank you for this moment.""\nJune 16, 2016: Kim Kardashian claims Taylor\nSwift knew of the infamous Kanye West\n“Famous” lyric all along'
 'on the matter, and asking, ""P.S. who did you guys piss off to leak that\nvideo?""\nDecember 16, 2021: Kim Kardashian says\nshe likes all of Taylor Swift’s songs']",Kim Kardashian claimed that Taylor Swift knew of the lyrics of Kanye West's song 'Famous' all along and approved it.,1.0,0.9769060377648713,1.0,0.9999999999666667,0.7442758704594852
1,What events contributed to the feud between Taylor Swift and Kim Kardashian?,I don't know.,"[""4/23/24, 6:05 PM\nA Timeline of Taylor Swift and Kim Kardashian's Feud\nhttps://people.com/taylor-swift-and-kim-kardashian-feud-timeline-8412119\n1/22\nPHOTO: KEVIN MAZUR/MTV1415/WIREIMAGE""
 ""4/23/24, 6:05 PM\nA Timeline of Taylor Swift and Kim Kardashian's Feud\nhttps://people.com/taylor-swift-and-kim-kardashian-feud-timeline-8412119\n11/22\nPHOTO: KEVIN WINTER/GETTY""
 ""4/23/24, 6:05 PM\nA Timeline of Taylor Swift and Kim Kardashian's Feud\nhttps://people.com/taylor-swift-and-kim-kardashian-feud-timeline-8412119\n5/22\nPHOTO: KEVIN MAZUR/MTV1415/WIREIMAGE""
 ""4/23/24, 6:05 PM\nA Timeline of Taylor Swift and Kim Kardashian's Feud\nhttps://people.com/taylor-swift-and-kim-kardashian-feud-timeline-8412119\n19/22\nMUSIC""]","On a July 2016 episode of Keeping Up with the Kardashians, the family discussed the feud between Taylor Swift and Kim Kardashian. Kim Kardashian defended Kanye West against Taylor Swift, which contributed to the feud.",,0.0,1.0,0.9999999999666667,0.17766884026415486
2,"How does Taylor Swift address the issue of character assassination in her song ""Look What You Made Me Do""?","Taylor Swift addresses the issue of character assassination in her song ""Look What You Made Me Do"" by reclaiming the snake emoji posted in her Instagram comments section, implying that she was being portrayed as a liar.","[""Taylor Swift - Look What You Made Me Do\nTaylor Swift - Look What You Made Me Do\nAdvertisement\nAd\ni\nThe Rewind: '13 Going 30'\xa0\nSUBSCRIBE\nSKIP TO CONTENT""
 'Joke\'s on you, guys. We\'re fine.\' ""\nShortly after, Swift\'s rep told PEOPLE, ""Taylor was never made aware of the\nactual lyrics, \'I made that bitch famous.\'""'
 'actual lyrics, \'I made that bitch famous.\'""\nThe Internet immediately seemed to side with the reality star, and\n#KimExposedTaylorParty started trending.\nJuly 17\n, 2016: Taylor Swift defends herself'
 'appeared to be her way of reclaiming the snake emoji posted in her\nInstagram comments section (implying that she was a liar).\nIn the music video for the song’s lead single “Look What You Made Me']","Taylor Swift addresses the issue of character assassination in her song ""Look What You Made Me Do"" by expressing her frustration at being falsely painted as a liar and being given an incomplete story. She also mentions being excluded from a narrative that she never asked to be a part of since 2009. The song references the drama involving Kanye West and Kim Kardashian.",1.0,0.9993133231856558,1.0,0.999999999975,0.7361898975349048
3,"How did Taylor Swift reference the Kanye West and Kim Kardashian drama in her music video for ""Look What You Made Me Do""?","Taylor Swift referenced the Kanye West and Kim Kardashian drama in her music video for ""Look What You Made Me Do.""","['then Kim posts it on the Internet.""\nAugust 27\n, 2017: Taylor Swift references\nKanye West and Kim Kardashian drama in\n“Look What You Made Me Do” music video\xa0\nTaylor Swift - Look What You Made Me Do'
 'April 19, 2024: Taylor Swift seemingly sings\nabout Kim Kardashian on The Tortured Poets\nDepartment\nAs Swift detailed the intense media scrutiny she has faced in the spotlight'
 'on the matter, and asking, ""P.S. who did you guys piss off to leak that\nvideo?""\nDecember 16, 2021: Kim Kardashian says\nshe likes all of Taylor Swift’s songs'
 'actual lyrics, \'I made that bitch famous.\'""\nThe Internet immediately seemed to side with the reality star, and\n#KimExposedTaylorParty started trending.\nJuly 17\n, 2016: Taylor Swift defends herself']",Taylor Swift referenced the Kanye West and Kim Kardashian drama in her music video for 'Look What You Made Me Do',1.0,0.9485484609648841,1.0,0.9999999999,0.9983897663632392
4,What was the nature of Kim Kardashian's friendship with Taylor Swift?,I don't know.,"[""JAY-Z and West for a photo, she was seen giving Kardashian a hug.\xa0\xa0\nAugust 30, 2015: Taylor Swift and Kim\nKardashian sit together at MTV VMAs\nAdvertisement\nAd\ni\nThe Rewind: '13 Going 30'\xa0\nSUBSCRIBE""
 'April 19, 2024: Taylor Swift seemingly sings\nabout Kim Kardashian on The Tortured Poets\nDepartment\nAs Swift detailed the intense media scrutiny she has faced in the spotlight'
 '11/22\nPHOTO: KEVIN WINTER/GETTY\nIn a candid cover story interview with Elle, Swift alluded to her rocky\nrelationship with West and Kardashian and spoke about how she learned\nto triumph over bullies.'
 '4/22\nFebruary 8, 2015: Taylor Swift and Kim\nKardashian share a hug at the Grammys\xa0\nPHOTO: LARRY BUSACCA/GETTY IMAGES FOR NARAS']",The friendship between Kim Kardashian and Taylor Swift was short-lived.,,0.0,0.0,0.249999999975,0.1825397138912422
5,"How did Taylor Swift reference the drama of being stabbed in the back in her music video for ""Look What You Made Me Do""?","Taylor Swift referenced the drama of being stabbed in the back by using various Easter eggs throughout the video, including snake imagery.","['appeared to be her way of reclaiming the snake emoji posted in her\nInstagram comments section (implying that she was a liar).\nIn the music video for the song’s lead single “Look What You Made Me'
 ""Taylor Swift - Look What You Made Me Do\nTaylor Swift - Look What You Made Me Do\nAdvertisement\nAd\ni\nThe Rewind: '13 Going 30'\xa0\nSUBSCRIBE\nSKIP TO CONTENT""
 'Joke\'s on you, guys. We\'re fine.\' ""\nShortly after, Swift\'s rep told PEOPLE, ""Taylor was never made aware of the\nactual lyrics, \'I made that bitch famous.\'""'
 'Do,” Swift referenced the drama with various Easter eggs throughout the\nvideo. In addition to having various snake imagery throughout, she also']","Taylor Swift referenced the drama of being stabbed in the back in her music video for ""Look What You Made Me Do"" by having the quote ""Et tu, Brute"" from William Shakespeare's play Julius Caesar written on her chair.",1.0,0.9156737396506506,0.0,0.99999999995,0.7232575328428745
6,How did Taylor Swift symbolically address the feud with Kim Kardashian in her album Reputation?,Taylor Swift symbolically addressed the feud with Kim Kardashian in her album Reputation dominated by snake imagery.,"['April 19, 2024: Taylor Swift seemingly sings\nabout Kim Kardashian on The Tortured Poets\nDepartment\nAs Swift detailed the intense media scrutiny she has faced in the spotlight'
 'the reality star, and #KimExposedTaylorParty started trending.\nThe following year, Swift responded to the drama with her sixth studio\nalbum Reputation, which was dominated by snake imagery as she'
 ""19/22\nMUSIC\nTaylor Swift Says Feud with Kanye West and Kim\nKardashian Felt Like 'Career Death': 'I Went Down\nReally, Really Hard'\nBy Sadie Bell\nMUSIC""
 'on the matter, and asking, ""P.S. who did you guys piss off to leak that\nvideo?""\nDecember 16, 2021: Kim Kardashian says\nshe likes all of Taylor Swift’s songs']","Taylor Swift symbolically addressed the feud with Kim Kardashian in her album Reputation by using snake imagery. She reclaimed the snake emoji that was posted in her Instagram comments section, which implied that she was a liar.",1.0,0.9406732878186591,0.5,0.9999999999666667,0.6186234902903622
